<!ELEMENT futbol (jornada+)>

<!ELEMENT jornada (partit+)>
<!ATTLIST jornada num CDATA #REQUIRED>

<!ELEMENT partit (dia, equip, equip)>
<!ATTLIST partit num CDATA #REQUIRED>

<!ELEMENT dia (#PCDATA)>

<!ELEMENT equip (nom, resultat, gols)>
<!ATTLIST equip juga CDATA #REQUIRED>

<!ELEMENT nom (#PCDATA)>
<!ELEMENT resultat (#PCDATA)>

<!ELEMENT gols (jugador*)>

<!ELEMENT jugador (#PCDATA)>